{
  "schema": "voxprint-forge-models/1",
  "app": "model-forge",
  "required": [
    "z-image",
    "qwen3-vl-4b-instruct",
    "mivolo-v2",
    "yunet-2023mar"
  ],
  "optional": [
    "florence2-large",
    "moss-image-base",
    "z-image-turbo",
    "dinov2-base"
  ],
  "models": [
    {
      "id": "z-image",
      "display_name": "Z-Image base (BF16)",
      "repo": "Tongyi-MAI/Z-Image",
      "revision": "04cc4abb7c5069926f75c9bfde9ef43d49423021",
      "license": "apache-2.0",
      "size": 20538488559,
      "files": [
        {
          "path": "model_index.json",
          "size": 467,
          "sha256": "1dbd162955866394e55e1964aee83b367aaaf9304e0591bbb9c9e58c4ddfce32"
        },
        {
          "path": "scheduler/scheduler_config.json",
          "size": 173,
          "sha256": "79bd98cddf1a60d365f3072d713ffad832239f57c837bba0e9da3cff40bfafc5"
        },
        {
          "path": "text_encoder/config.json",
          "size": 726,
          "sha256": "8ba006f74fecfaaeb392872a60f4a480e7ec9860153d2e1b769ec81f9a147f8a"
        },
        {
          "path": "text_encoder/generation_config.json",
          "size": 239,
          "sha256": "2325da0f15bb848e018c5ae071b7943332e9f871d6b60e2ed22ca97d4cb993d2"
        },
        {
          "path": "text_encoder/model-00001-of-00003.safetensors",
          "size": 3957900840,
          "sha256": "328a91d3122359d5547f9d79521205bc0a46e1f79a792dfe650e99fc2d651223"
        },
        {
          "path": "text_encoder/model-00002-of-00003.safetensors",
          "size": 3987450520,
          "sha256": "6cd087b316306a68c562436b5492edbcf6e16c6dba3a1308279caa5a58e21ca5"
        },
        {
          "path": "text_encoder/model-00003-of-00003.safetensors",
          "size": 99630640,
          "sha256": "7ca841ee75b9c61267c0c6148fd8d096d3d21b6d3e161256a9b878154f91fc52"
        },
        {
          "path": "text_encoder/model.safetensors.index.json",
          "size": 32819,
          "sha256": "6dc0981b8829fead746441f68f38f24c5ca4a3a66351f652c26c6df0efc43ab2"
        },
        {
          "path": "tokenizer/merges.txt",
          "size": 1671853,
          "sha256": "8831e4f1a044471340f7c0a83d7bd71306a5b867e95fd870f74d0c5308a904d5"
        },
        {
          "path": "tokenizer/tokenizer.json",
          "size": 11422654,
          "sha256": "aeb13307a71acd8fe81861d94ad54ab689df773318809eed3cbe794b4492dae4"
        },
        {
          "path": "tokenizer/tokenizer_config.json",
          "size": 9732,
          "sha256": "d5d09f07b48c3086c508b30d1c9114bd1189145b74e982a265350c923acd8101"
        },
        {
          "path": "tokenizer/vocab.json",
          "size": 2776833,
          "sha256": "ca10d7e9fb3ed18575dd1e277a2579c16d108e32f27439684afa0e10b1440910"
        },
        {
          "path": "transformer/config.json",
          "size": 500,
          "sha256": "2cf1166cbc4a597de70c8f6ee9bc5e792a43a3eceb0ec0a2a3cd30591142443c"
        },
        {
          "path": "transformer/diffusion_pytorch_model-00001-of-00002.safetensors",
          "size": 9973727144,
          "sha256": "ecd5df7768856215812af84d5cc785ba9d84c6d8c84e6939c7ccf30a2e0d2425"
        },
        {
          "path": "transformer/diffusion_pytorch_model-00002-of-00002.safetensors",
          "size": 2336146728,
          "sha256": "e2d5fb75ca504b2d669a33af9380b68e0c1632ecddbfca85f82631958a4b81b1"
        },
        {
          "path": "transformer/diffusion_pytorch_model.safetensors.index.json",
          "size": 48969,
          "sha256": "8edf79f7a11cc6dbc5f080f1f8bce44bfcd3c1d9a472d6724ff76b65b359fea4"
        },
        {
          "path": "vae/config.json",
          "size": 820,
          "sha256": "ad6f0acb584ceb3d136d1e32b684dec65db24bffe9223df2bac0b45539d4e6b5"
        },
        {
          "path": "vae/diffusion_pytorch_model.safetensors",
          "size": 167666902,
          "sha256": "f5b59a26851551b67ae1fe58d32e76486e1e812def4696a4bea97f16604d40a3"
        }
      ]
    },
    {
      "id": "qwen3-vl-4b-instruct",
      "display_name": "Qwen3-VL-4B-Instruct",
      "repo": "Qwen/Qwen3-VL-4B-Instruct",
      "revision": "ebb281ec70b05090aa6165b016eac8ec08e71b17",
      "license": "apache-2.0",
      "size": 8887284080,
      "files": [
        {
          "path": "chat_template.json",
          "size": 5502,
          "sha256": "6f8a6a55027e3da5160105556cda5dd69f6423f1c32645f6730d32de7773d0c4"
        },
        {
          "path": "config.json",
          "size": 1505,
          "sha256": "edac7703329133edfc53e46ac0081835144c99d7eebf28b71c732694d435224d"
        },
        {
          "path": "generation_config.json",
          "size": 269,
          "sha256": "8469742d1fce0de951c8909b26a2c0c0d8490837ce476efb114da9e0cefc4d44"
        },
        {
          "path": "merges.txt",
          "size": 1671839,
          "sha256": "599bab54075088774b1733fde865d5bd747cbcc7a547c5bc12610e874e26f5e3"
        },
        {
          "path": "model-00001-of-00002.safetensors",
          "size": 4967229296,
          "sha256": "30a01a0556622645a3cce87b655bbbbbc1f170c196099f1b666c93202c3339a9"
        },
        {
          "path": "model-00002-of-00002.safetensors",
          "size": 3908490048,
          "sha256": "046296a2a387efb43b0c997d5833c789604d168834f6e0d3064bf7bb13d002a6"
        },
        {
          "path": "model.safetensors.index.json",
          "size": 64742,
          "sha256": "58a7841d7bff2548dd91577d216274a83cf1b500bc6a534b809d6c1b1707cf2b"
        },
        {
          "path": "preprocessor_config.json",
          "size": 390,
          "sha256": "27225450ac9c6529872ee1924fcb0962ff5634834f817040f444118116f4e516"
        },
        {
          "path": "tokenizer.json",
          "size": 7032403,
          "sha256": "a5d85b6dcc535e6b93115a9ef287e6132fdbf30270da6218194ba742261173c7"
        },
        {
          "path": "tokenizer_config.json",
          "size": 10868,
          "sha256": "c2da771801886ad9ae98181793ffd3dfb7f1af30f6f7c6a4e15d7dbba52e2399"
        },
        {
          "path": "video_preprocessor_config.json",
          "size": 385,
          "sha256": "7768af27c1fafa9cc9011c1dc20067e03f8915e03b63504550e11d5066986d13"
        },
        {
          "path": "vocab.json",
          "size": 2776833,
          "sha256": "ca10d7e9fb3ed18575dd1e277a2579c16d108e32f27439684afa0e10b1440910"
        }
      ]
    },
    {
      "id": "mivolo-v2",
      "display_name": "MiVOLO v2",
      "repo": "iitolstykh/mivolo_v2",
      "revision": "53393526c220e34cdd7b722b36d22b6f9e5f4241",
      "license": "apache-2.0",
      "size": 115087778,
      "files": [
        {
          "path": "config.json",
          "size": 924,
          "sha256": "aa273722873361e4e77b0cea20d02311eb5bf39e521d8a09c66a5365d4ec4e9c"
        },
        {
          "path": "configuration_mivolo.py",
          "size": 1462,
          "sha256": "57f3d4192625d1d1d73c60ba8777de24a1a868455e90e889e68eeb84c4b14ff9"
        },
        {
          "path": "mivolo_image_processor.py",
          "size": 1513,
          "sha256": "2e553f2b7f80223061f957e6d0ad6df009d5c5904b81836777701dce622d6311"
        },
        {
          "path": "model.safetensors",
          "size": 115078528,
          "sha256": "96efb47051c038ebeec74b73b4253c5fd000433e5afcab7deee0bd8f3fa7bf18"
        },
        {
          "path": "modeling_mivolo.py",
          "size": 5255,
          "sha256": "051b3b83cc1829d1d646dde2a0d65b73847afb34841c27cf61dfbdd79c7c8f4b"
        },
        {
          "path": "preprocessor_config.json",
          "size": 96,
          "sha256": "e89b04cf5516faf28a434f5ee098281ef5d0e52c942b5d85b240bf89be32c567"
        }
      ]
    },
    {
      "id": "yunet-2023mar",
      "display_name": "YuNet face detector (2023mar)",
      "url": "https://github.com/opencv/opencv_zoo/raw/47534e27c9851bb1128ccc0102f1145e27f23f98/models/face_detection_yunet/",
      "revision": "47534e27c9851bb1128ccc0102f1145e27f23f98",
      "license": "mit",
      "size": 233674,
      "files": [
        {
          "path": "LICENSE",
          "size": 1085,
          "sha256": "c83b8120c50ccbd4c4f96edf53141bdd566ebb8f8e9227e415326aa1b1aba958"
        },
        {
          "path": "face_detection_yunet_2023mar.onnx",
          "size": 232589,
          "sha256": "8f2383e4dd3cfbb4553ea8718107fc0423210dc964f9f4280604804ed2552fa4"
        }
      ]
    },
    {
      "id": "florence2-large",
      "display_name": "Florence-2-large",
      "repo": "microsoft/Florence-2-large",
      "revision": "21a599d414c4d928c9032694c424fb94458e3594",
      "license": "mit",
      "size": 1556214930,
      "files": [
        {
          "path": "LICENSE",
          "size": 1141,
          "sha256": "c2cfccb812fe482101a8f04597dfc5a9991a6b2748266c47ac91b6a5aae15383"
        },
        {
          "path": "config.json",
          "size": 2445,
          "sha256": "6f8a8f92a74ce18b5c1e5646b4a8222477dd1ac49f31b953e75d6fc3e0f8583a"
        },
        {
          "path": "configuration_florence2.py",
          "size": 15119,
          "sha256": "de2e45a975b3582de05d2f4d963a3e9f9a3d20dccf78d28e0052932a0be93bdf"
        },
        {
          "path": "generation_config.json",
          "size": 51,
          "sha256": "30e9865458ecc8ee931eeeb43f44f1d169c5ab95be39e0072142a7a6b8f31990"
        },
        {
          "path": "model.safetensors",
          "size": 1553563458,
          "sha256": "4f38ce741c6b71188fe2b3419a55e11917a8a7b321ae2e63c61da0191b0ebad7"
        },
        {
          "path": "modeling_florence2.py",
          "size": 127455,
          "sha256": "5162bf465e61b6e29cc113a467630ec3cb56ed8e4d46eb6207157f10fb9b8a24"
        },
        {
          "path": "preprocessor_config.json",
          "size": 806,
          "sha256": "2f5921bbc53c7cc04251e1027b45b1cec726276be6db23d1bb40641bfbe2cf29"
        },
        {
          "path": "processing_florence2.py",
          "size": 48674,